{"type": "config", "name": "tokenizer perf (PR #22): estimate_tokens / encode_ordinary ns per byte", "metricName": "composite_ns_per_byte", "metricUnit": "", "bestDirection": "lower"}
{"run": 0, "commit": "fb48720", "metric": 133.5764, "metrics": {"composite_ratio": 0.9994, "composite_ci_hi": 1.0085, "cold_start_us": 27555.1, "ipc": 3.479, "instructions_g": 9.105, "branch_miss_pct": 0.624, "adversarial_long_piece_ratio": 0.9999, "ascii_prose_ratio": 0.9913, "ascii_prose_count_ratio": 0.9935, "cjk_ratio": 1.0009, "code_ratio": 0.9936, "code_count_ratio": 1.0044, "mixed_unicode_ratio": 1.0052, "numeric_ratio": 1.0059, "short_strings_ratio": 0.9989, "whitespace_heavy_ratio": 1.0004}, "status": "keep", "description": "Phase 0: harness (arms bench, report.sh ABBA+bootstrap, guard.sh, differential + parity tests), baseline, A/A control", "timestamp": 1788486224139, "segment": 0, "confidence": null, "asi": {"hypothesis": "H0 baseline; harness A/A calibrates within 1%", "aa_verdict": "AA_OK", "note": "first KCCK-only A/A failed (position effect +0.5%); alternating KCCK/CKKC templates fixed it", "tools": "autoresearch gated tools inactive in this session; log written by hand in the extension's schema"}}
{"run": 2, "commit": "f41a988", "metric": 22.0555, "metrics": {"composite_ratio": 0.1647, "composite_ci_hi": 0.1655, "cold_start_us": 9456.8, "ipc": 3.224, "instructions_g": 2.966, "branch_miss_pct": 0.604, "adversarial_long_piece_ratio": 0.9983, "ascii_prose_ratio": 0.0769, "ascii_prose_count_ratio": 0.0768, "cjk_ratio": 0.6055, "code_ratio": 0.0536, "code_count_ratio": 0.0535, "mixed_unicode_ratio": 0.2203, "numeric_ratio": 0.1231, "short_strings_ratio": 0.3009, "whitespace_heavy_ratio": 0.1756}, "status": "keep", "description": "[A] H1 hand-written scanner replaces fancy-regex: composite 133.58->22.06 (0.165 [0.164,0.166]); every arm improves; cold start 27.6->9.5 ms; fancy-regex now dev-dep only", "timestamp": 1788487580570, "segment": 0, "confidence": null, "asi": {"hypothesis": "H1 hand-written scanner replaces fancy-regex", "verdict": "KEEP", "learned": "fancy-regex backtracking VM was 80% of ASCII-arm time; scanner is ~40 lines + generated L/N range tables; cjk only 0.61x because merge loop dominates there", "next": "H2 in-crate BPE (cjk 34 ns/B, adversarial 1353 ns/B)"}}
{"run": 3, "commit": "5a2d2a5", "metric": 18.0772, "metrics": {"composite_ratio": 0.8154, "composite_ci_hi": 0.8183, "cold_start_us": 9957.0, "ipc": 3.101, "instructions_g": 2.577, "branch_miss_pct": 0.764, "adversarial_long_piece_ratio": 0.9113, "ascii_prose_ratio": 0.8964, "ascii_prose_count_ratio": 0.893, "cjk_ratio": 0.7513, "code_ratio": 0.7665, "code_count_ratio": 0.7639, "mixed_unicode_ratio": 0.7025, "numeric_ratio": 0.7451, "short_strings_ratio": 0.8407, "whitespace_heavy_ratio": 0.9196}, "status": "keep", "description": "[A] H2 in-crate BPE (2-byte table, scratch, direct output): 22.06->18.08 (0.815 [0.812,0.818]); all arms improve 8-30%; tiktoken-rs now dev-dep only", "timestamp": 1788487901465, "segment": 0, "confidence": null, "asi": {"hypothesis": "H2 in-crate BPE (2-byte table, scratch, direct output)", "verdict": "KEEP", "learned": "initial pair ranks via 256x256 table avoid ~n hashes per piece; per-piece Vec allocs gone; remaining merge cost is the O(n*m) rescan + Vec::remove", "next": "H3 linear merge for long pieces (adversarial 1233 ns/B is 68x cjk)"}}
{"run": 4, "commit": "a38967a", "metric": 13.8045, "metrics": {"composite_ratio": 0.7662, "composite_ci_hi": 0.7683, "cold_start_us": 9720.1, "ipc": 2.678, "instructions_g": 0.719, "branch_miss_pct": 1.806, "adversarial_long_piece_ratio": 0.0833, "ascii_prose_ratio": 0.9776, "ascii_prose_count_ratio": 0.972, "cjk_ratio": 0.9495, "code_ratio": 0.9515, "code_count_ratio": 0.9497, "mixed_unicode_ratio": 0.9805, "numeric_ratio": 0.9615, "short_strings_ratio": 0.9948, "whitespace_heavy_ratio": 1.0958}, "status": "discard", "description": "[A] H3 heap merge engine for pieces > 64 B: composite 0.766 [0.764,0.768] but whitespace_heavy regressed 1.096 [1.090,1.104] > 1.03 rule; adversarial 0.083", "timestamp": 1788488156524, "segment": 0, "confidence": null, "asi": {"hypothesis": "H3 heap merge engine for pieces > 64 B", "verdict": "DISCARD", "learned": "crossover scan/heap measured: ~192-256 B for ASCII whitespace/letter runs, ~32 B for CJK (3-byte chars, many merges). Heap per-pair push cost dominates on all-whitespace runs where every pair has a rank", "rollback_reason": "single-arm regression rule", "next_action_hint": "H3b: threshold 192 (or 32 when piece has non-ASCII bytes)"}}
{"run": 5, "commit": "0e20802", "metric": 13.6816, "metrics": {"composite_ratio": 0.7587, "composite_ci_hi": 0.7599, "cold_start_us": 9732.7, "ipc": 2.718, "instructions_g": 0.733, "branch_miss_pct": 1.651, "adversarial_long_piece_ratio": 0.0833, "ascii_prose_ratio": 0.9787, "ascii_prose_count_ratio": 0.9747, "cjk_ratio": 0.9769, "code_ratio": 0.947, "code_count_ratio": 0.9479, "mixed_unicode_ratio": 0.9773, "numeric_ratio": 0.9611, "short_strings_ratio": 0.9965, "whitespace_heavy_ratio": 0.9694}, "status": "keep", "description": "[A] H3b heap merge engine above 192 B: 18.08->13.68 (0.759 [0.757,0.760]); adversarial 1233->103 ns/B (0.083); no arm regresses", "timestamp": 1788488286691, "segment": 0, "confidence": null, "asi": {"hypothesis": "H3b heap merge engine above 192 B", "verdict": "KEEP", "learned": "threshold 192 keeps whitespace_heavy on scan engine; ASCII arms also gained 2-5%, likely codegen from splitting encode_piece (whole-piece hit path smaller)", "next": "H4 count-only path or H7 rank lookup; re-attribute first since profile moved"}}
{"run": 6, "commit": "946f547", "metric": 19.9444, "metrics": {"composite_ratio": 1.4578, "composite_ci_hi": 1.4587, "cold_start_us": 17121.5, "ipc": 2.187, "instructions_g": 0.853, "branch_miss_pct": 1.818, "adversarial_long_piece_ratio": 1.0969, "ascii_prose_ratio": 2.1592, "ascii_prose_count_ratio": 2.1631, "cjk_ratio": 1.1753, "code_ratio": 1.4801, "code_count_ratio": 1.4828, "mixed_unicode_ratio": 1.4126, "numeric_ratio": 1.3187, "short_strings_ratio": 1.3037, "whitespace_heavy_ratio": 1.351}, "status": "discard", "description": "[A] H7 inline u64 keys (FxHashMap<u64>) for 1..=7-byte tokens: composite 1.458 [1.457,1.459]; ascii_prose 2.16x slower; cold start 1.75x", "timestamp": 1788488548033, "segment": 0, "confidence": null, "asi": {"hypothesis": "H7 inline u64 keys (FxHashMap<u64>) for 1..=7-byte tokens", "verdict": "DISCARD", "learned": "FxHash on u64 = key*SEED: low bits of the product depend only on low bits of the key, hashbrown indexes buckets by low bits, and 3-7 byte ASCII tokens share their first two bytes heavily -> long probe chains. Inline keys are not the problem; the integer hash is", "rollback_reason": "hash quality", "next_action_hint": "H7b: same layout with a real 64-bit mixer (splitmix finalizer) as the hasher"}}
{"run": 7, "commit": "297cdf2", "metric": 13.9293, "metrics": {"composite_ratio": 1.0161, "composite_ci_hi": 1.0179, "cold_start_us": 15745.0, "ipc": 2.778, "instructions_g": 0.787, "branch_miss_pct": 1.756, "adversarial_long_piece_ratio": 1.0239, "ascii_prose_ratio": 1.057, "ascii_prose_count_ratio": 1.0578, "cjk_ratio": 0.9503, "code_ratio": 0.9988, "code_count_ratio": 1.0025, "mixed_unicode_ratio": 1.0544, "numeric_ratio": 0.9494, "short_strings_ratio": 0.9932, "whitespace_heavy_ratio": 1.0835}, "status": "discard", "description": "[A] H7b inline u64 keys + splitmix64 hasher: composite 1.016 [1.014,1.018]; cjk/numeric -5% but ascii_prose/mixed +5.5%, whitespace +8%; cold start 1.6x (second 65k-entry table build)", "timestamp": 1788488682437, "segment": 0, "confidence": null, "asi": {"hypothesis": "H7b inline u64 keys + splitmix64 hasher", "verdict": "DISCARD", "learned": "inline keys do not beat FxHashMap<Vec<u8>> here: ascii_prose pieces mostly hit the whole-piece lookup once, where the Vec<u8> key compare on a 4-7 byte token is one cache line anyway; splitmix mixing costs ~3 multiplies vs Fx 1 per probe. Vocab build now populates two maps -> cold start regresses", "rollback_reason": "composite regression", "next_action_hint": "attack lookup count instead of lookup cost: H4 count-only path, H6 output capacity, or skip the whole-piece hash for 1-2 byte pieces via tables (already), and avoid hashing in span_rank for 2-byte spans (already). Try B: avoid rank_of recomputation for final ids by caching ranks in parts"}}
{"run": 8, "commit": "cacbe7a", "metric": 15.4103, "metrics": {"composite_ratio": 1.1283, "composite_ci_hi": 1.1327, "cold_start_us": 15391.7, "ipc": 2.303, "instructions_g": 0.731, "branch_miss_pct": 2.867, "adversarial_long_piece_ratio": 0.9798, "ascii_prose_ratio": 1.1749, "ascii_prose_count_ratio": 1.1781, "cjk_ratio": 1.2763, "code_ratio": 0.9734, "code_count_ratio": 0.9796, "mixed_unicode_ratio": 1.1198, "numeric_ratio": 1.2148, "short_strings_ratio": 1.2227, "whitespace_heavy_ratio": 1.2182}, "status": "discard", "description": "[A] H7c open-addressing inline-key table + tag bytes for 1..=7-byte tokens: composite 1.128 [1.124,1.133]; branch-miss 1.65->2.87%, cache-misses 2x vs FxHashMap<Vec<u8>>; code -2.5% only arm to gain", "timestamp": 1788489284286, "segment": 0, "confidence": null, "asi": {"hypothesis": "H7c open-addressing inline-key table + tag bytes for 1..=7-byte tokens", "verdict": "DISCARD", "learned": "three inline-key layouts (Fx u64, splitmix u64 via hashbrown, hand-rolled linear probing with tags) all lose to FxHashMap<Vec<u8>>. Root cause: most rank lookups in the merge loop are MISSES (candidate pairs not in vocab); hashbrown resolves a miss with one 16-byte SIMD group compare, linear probing at load 0.72 walks ~7 tag bytes with a mispredicting exit; at load 0.36 the 2 MB table falls out of L2. The whole-piece hit path is not the bottleneck", "rollback_reason": "composite regression; 3rd consecutive discard at this hypothesis -> change altitude", "next_action_hint": "C: SWAR ASCII scanner (piece_end+class_at = 32% of ascii_prose); B: output with_capacity; A: H5 cold start; later revisit lookup as a SWAR-group table if ever"}}
{"run": 9, "commit": "6c4b943", "metric": 12.8008, "metrics": {"composite_ratio": 0.9356, "composite_ci_hi": 0.9378, "cold_start_us": 9942.5, "ipc": 2.773, "instructions_g": 0.682, "branch_miss_pct": 1.844, "adversarial_long_piece_ratio": 0.9842, "ascii_prose_ratio": 0.8351, "ascii_prose_count_ratio": 0.8371, "cjk_ratio": 1.0062, "code_ratio": 0.907, "code_count_ratio": 0.9073, "mixed_unicode_ratio": 1.0078, "numeric_ratio": 0.9548, "short_strings_ratio": 0.9908, "whitespace_heavy_ratio": 0.9464}, "status": "keep", "description": "[C] H9 SWAR 8-byte ASCII class-run scan: 13.68->12.80 (0.936 [0.933,0.938]); ascii_prose 0.835, code 0.907; cjk/mixed +0.6-0.8% within rule (first-word check cost on non-ASCII)", "timestamp": 1788489616529, "segment": 0, "confidence": null, "asi": {"hypothesis": "H9 SWAR 8-byte ASCII class-run scan", "verdict": "KEEP", "learned": "SWAR eq() must be written as !((x^v)+0x7F) & HI; the sub-based form carries across lanes. Exhaustive per-lane test now guards it. One guard rework used.", "next": "B: output Vec capacity / count-only path; A: H5 cold start (9.9 ms, base64 parse of 65k lines)"}}
{"run": 10, "commit": "c51ac1f", "metric": 13.3796, "metrics": {"composite_ratio": 1.0434, "composite_ci_hi": 1.0456, "cold_start_us": 13261.6, "ipc": 2.557, "instructions_g": 0.728, "branch_miss_pct": 2.267, "adversarial_long_piece_ratio": 1.0235, "ascii_prose_ratio": 0.9613, "ascii_prose_count_ratio": 0.9595, "cjk_ratio": 1.1212, "code_ratio": 0.9834, "code_count_ratio": 0.9815, "mixed_unicode_ratio": 1.0679, "numeric_ratio": 1.0273, "short_strings_ratio": 1.1033, "whitespace_heavy_ratio": 1.2368}, "status": "discard", "description": "[B] H11 inline fixed-width key compare (TokenKey/Span, no memcmp): composite 1.043 [1.041,1.046]; ascii_prose 0.961 but cjk 1.121, short_strings 1.103", "timestamp": 1788489994536, "segment": 0, "confidence": null, "asi": {"hypothesis": "H11 inline fixed-width key compare (TokenKey/Span, no memcmp)", "verdict": "DISCARD", "learned": "replacing memcmp with 2 overlapping loads helps prose (4-8 B ASCII tokens) but the length-band match adds a mispredicting branch on CJK/whitespace runs where key lengths vary per probe; net loss. One unsafe block was needed (Path-style repr(transparent) cast) and is gone with the revert.", "rollback_reason": "cjk/short regress", "next_action_hint": "stop chasing the compare; reduce lookups: keep part ranks so the final windows() pass reuses the merge results (each merged span was just looked up)"}}
{"run": 11, "commit": "6ea5804", "metric": 12.7165, "metrics": {"composite_ratio": 0.9939, "composite_ci_hi": 1.0001, "cold_start_us": 10211.8, "ipc": 2.741, "instructions_g": 0.717, "branch_miss_pct": 1.833, "adversarial_long_piece_ratio": 1.0123, "ascii_prose_ratio": 0.9895, "ascii_prose_count_ratio": 0.9881, "cjk_ratio": 0.9822, "code_ratio": 0.9766, "code_count_ratio": 0.9762, "mixed_unicode_ratio": 0.989, "numeric_ratio": 0.9804, "short_strings_ratio": 0.9607, "whitespace_heavy_ratio": 1.0891}, "status": "discard", "description": "[B] H12 carry token ranks through merge (no id-pass lookups): composite 0.994 [0.988,1.000] fails CI<1 and whitespace_heavy 1.089 [1.062,1.144] > 1.03; short_strings 0.961, cjk 0.982", "timestamp": 1788490234551, "segment": 0, "confidence": null, "asi": {"hypothesis": "H12 carry token ranks through merge (no id-pass lookups)", "verdict": "DISCARD", "learned": "saving the final windows() lookups (~1 per output token) is worth 2-4% on short/cjk but the extra 4-byte token field per part makes parts.remove and the min-scan slower on long whitespace runs. Reworks tried: pack Part to 8 bytes (u16 token, u8 start) -> whitespace +22% cycles (?), branch-free u64 min over (rank<<32|idx) -> +20% instructions everywhere; both worse.", "rollback_reason": "single-arm rule + composite CI", "next_action_hint": "whitespace_heavy is dominated by merge_scan on long runs (avg piece 7.5 B but 3258 pieces >16 B); consider lowering HEAP_THRESHOLD per class or a cheaper rescan (SoA ranks array so min-scan is a tight u32 loop)"}}
{"run": 12, "commit": "fc93815", "metric": 12.2486, "metrics": {"composite_ratio": 0.9537, "composite_ci_hi": 0.9567, "cold_start_us": 10632.6, "ipc": 2.642, "instructions_g": 0.685, "branch_miss_pct": 1.868, "adversarial_long_piece_ratio": 1.0047, "ascii_prose_ratio": 0.9523, "ascii_prose_count_ratio": 0.9505, "cjk_ratio": 0.9352, "code_ratio": 0.9245, "code_count_ratio": 0.9238, "mixed_unicode_ratio": 0.9045, "numeric_ratio": 0.9766, "short_strings_ratio": 0.9729, "whitespace_heavy_ratio": 0.9974}, "status": "keep", "description": "[C] H13 two-bit BMP class table + hoisted OnceLock read: 12.80->12.25 (0.954 [0.950,0.957]); mixed 0.905, cjk 0.935, code 0.925; cold +0.7 ms (16 KiB table build, 65k class_from_tables calls)", "timestamp": 1788490422588, "segment": 0, "confidence": null, "asi": {"hypothesis": "H13 two-bit BMP class table + hoisted OnceLock read", "verdict": "KEEP", "learned": "reading the OnceLock per character cost ~3% on ASCII arms by itself; passing the table reference in recovered it and more. Cold start now 10.6 ms; H5 (precomputed vocab + table) is next-most valuable for cold", "next": "H5 cold start via build.rs-generated tables, or B: SoA rank array for merge_scan"}}
{"run": 13, "commit": "612813f", "metric": 12.2579, "metrics": {"composite_ratio": 1.0015, "composite_ci_hi": 1.0029, "cold_start_us": 3009.9, "ipc": 2.442, "instructions_g": 0.602, "branch_miss_pct": 2.206, "adversarial_long_piece_ratio": 0.9964, "ascii_prose_ratio": 1.0017, "ascii_prose_count_ratio": 1.0023, "cjk_ratio": 0.9935, "code_ratio": 0.9936, "code_count_ratio": 0.9953, "mixed_unicode_ratio": 1.007, "numeric_ratio": 1.0132, "short_strings_ratio": 0.9947, "whitespace_heavy_ratio": 1.0176}, "status": "keep", "description": "[A] H5 build.rs-decoded vocabulary blob + BMP table: NEUTRAL 1.0015 [1.0000,1.0029], no arm >1.03; cold start 10.7->3.0 ms (0.28); base64 leaves the runtime dependency graph (build-dep only); hash keys borrow the blob", "timestamp": 1788490597831, "segment": 0, "confidence": null, "asi": {"hypothesis": "H5 build.rs-decoded vocabulary blob + BMP table", "verdict": "keep (simpler)", "learned": "warm path unchanged as expected (same FxHashMap probe); &[u8] keys vs Vec<u8> made no measurable difference. Cold start now dominated by 65k hash inserts (~2.9 ms). rlib +9.6% (embedded blob + tables), bench binary -48% vs baseline", "next": "B: SoA rank array for the merge_scan min pass (whitespace_heavy/numeric/cjk span_rank+scan = 60%); or C: AVX2 32-byte class scan"}}
{"run": 14, "commit": "f71496a", "metric": 12.0771, "metrics": {"composite_ratio": 0.9866, "composite_ci_hi": 0.9876, "cold_start_us": 3011.8, "ipc": 2.357, "instructions_g": 0.565, "branch_miss_pct": 2.518, "adversarial_long_piece_ratio": 0.9999, "ascii_prose_ratio": 0.9966, "ascii_prose_count_ratio": 0.9992, "cjk_ratio": 1.0, "code_ratio": 0.9897, "code_count_ratio": 0.994, "mixed_unicode_ratio": 0.9847, "numeric_ratio": 1.0006, "short_strings_ratio": 0.9079, "whitespace_heavy_ratio": 0.9972}, "status": "keep", "description": "[B] H6 output Vec::with_capacity(len/3): 12.26->12.08 (0.987 [0.986,0.988]); short_strings 0.908 (one alloc instead of 2-3 per call); no arm >1.0", "timestamp": 1788490741952, "segment": 0, "confidence": null, "asi": {"hypothesis": "H6 output Vec::with_capacity(len/3)", "verdict": "KEEP", "learned": "growth mattered only for short strings; for 256 KiB arms the doubling amortizes away", "next": "B: SoA rank array in merge_scan; C: AVX2 class scan; A: count-only path (H4) now that Vec alloc is the only encode-vs-count difference"}}
{"run": 15, "commit": "(none)", "metric": 0, "metrics": {}, "status": "discard", "description": "[B] H14a 4-lane u64 min in merge_scan rescan: more instructions per element; cmov chain already ~1 cycle/element", "timestamp": 1788490894177, "segment": 0, "confidence": null, "asi": {"hypothesis": "H14a 4-lane u64 min in merge_scan rescan", "verdict": "discard (prescreen)", "evidence": "whitespace_heavy cycles 1.00; cjk 1.04; short_strings 1.03; numeric 1.01 (perf stat, 40 iters)"}}
{"run": 16, "commit": "(none)", "metric": 0, "metrics": {}, "status": "discard", "description": "[B] H14b SoA pair-rank stream for merge_scan: second Vec::remove per merge costs more than the narrower min scan saves", "timestamp": 1788490894177, "segment": 0, "confidence": null, "asi": {"hypothesis": "H14b SoA pair-rank stream for merge_scan", "verdict": "discard (prescreen)", "evidence": "whitespace_heavy cycles 1.08; cjk 1.07; short_strings 1.07; numeric 1.05 (perf stat, 40 iters)"}}
{"run": 17, "commit": "1cf3cc5", "metric": 11.8418, "metrics": {"composite_ratio": 0.9819, "composite_ci_hi": 0.985, "cold_start_us": 3044.1, "ipc": 2.311, "instructions_g": 0.564, "branch_miss_pct": 2.366, "adversarial_long_piece_ratio": 1.0048, "ascii_prose_ratio": 0.9722, "ascii_prose_count_ratio": 0.9761, "cjk_ratio": 0.9257, "code_ratio": 0.9771, "code_count_ratio": 0.9817, "mixed_unicode_ratio": 0.9901, "numeric_ratio": 0.9887, "short_strings_ratio": 1.0073, "whitespace_heavy_ratio": 0.9973}, "status": "keep", "description": "[A] H3c heap threshold 40 B for non-ASCII-leading pieces: 12.08->11.84 (0.982 [0.980,0.985]); cjk 0.926; short_strings 1.007 (extra byte test) within rule", "timestamp": 1788491024675, "segment": 0, "confidence": null, "asi": {"hypothesis": "H3c heap threshold 40 B for non-ASCII-leading pieces", "verdict": "KEEP", "learned": "per-class thresholds matter because merges/byte differ ~4x between CJK and ASCII runs", "next": "H4 count-only path; C AVX2 32-byte scan; D report LTO/PGO"}}
{"run": 18, "commit": "(none)", "metric": 0, "metrics": {}, "status": "discard", "description": "[A] H4 count-only path (Sink trait, then const-generic COUNT_ONLY): skipping the final per-token rank_of saves too little: ASCII pieces are mostly whole-token hits with no merge; and both generic shapes pessimized the encode path", "timestamp": 1788491184350, "segment": 0, "confidence": null, "asi": {"hypothesis": "H4 count-only path (Sink trait, then const-generic COUNT_ONLY)", "verdict": "discard (prescreen)", "evidence": "ascii_prose_count cycles 1.04-1.14; encode arms ALSO +9-16% (codegen of the shared merge loop changed); cjk 1.00-1.05", "next_action_hint": "C: AVX2 32-byte class scan behind runtime dispatch; D: LTO/PGO recommendations; then re-attribute"}}
{"run": 19, "commit": "8a3bc17", "metric": 10.5294, "metrics": {"composite_ratio": 0.8841, "composite_ci_hi": 0.8898, "cold_start_us": 2750.9, "ipc": 2.226, "instructions_g": 0.512, "branch_miss_pct": 2.24, "adversarial_long_piece_ratio": 1.0238, "ascii_prose_ratio": 0.7394, "ascii_prose_count_ratio": 0.7393, "cjk_ratio": 0.9496, "code_ratio": 0.8788, "code_count_ratio": 0.8787, "mixed_unicode_ratio": 0.967, "numeric_ratio": 0.8755, "short_strings_ratio": 0.9471, "whitespace_heavy_ratio": 0.8868}, "status": "keep", "description": "[A] H7d hashbrown HashTable, inline packed u64 keys for 3..=7-byte tokens: 11.84->10.53 (0.884 [0.874,0.890]); ascii_prose 0.739, code 0.879, numeric 0.876; cold 3.0->2.75 ms (single-pass build); +1 runtime dep (hashbrown, already in lockfile via std)", "timestamp": 1788491725755, "segment": 0, "confidence": null, "asi": {"hypothesis": "H7d hashbrown HashTable, inline packed u64 keys for 3..=7-byte tokens", "verdict": "KEEP", "learned": "the winning combination is inline key + SIMD group probe + a hash whose low bits mix (multiply then fold high half). Iterations 6/7/8 each lacked one of the three.", "next": "C: AVX2 32-byte scan; D: LTO/PGO report; re-attribute at iteration 20"}}
