{"run": 20, "commit": "(none)", "metric": 0, "metrics": {}, "status": "discard", "description": "[B] H15 12-byte ShortEntry (u32 key halves) to shrink the short table to 768 KiB: no measurable change: the table's hot subset already fits cache; entry size is not the limiter", "timestamp": 1788491795086, "segment": 0, "confidence": null, "asi": {"hypothesis": "H15 12-byte ShortEntry (u32 key halves) to shrink the short table to 768 KiB", "verdict": "discard (prescreen)", "evidence": "ascii_prose cycles 1.00; code 0.98; numeric 1.00; short 0.99; cjk 1.01 (perf stat, 40 iters)"}}
{"run": 21, "commit": "b11b45f", "metric": 9.6717, "metrics": {"composite_ratio": 0.9211, "composite_ci_hi": 0.9228, "cold_start_us": 2688.7, "ipc": 2.599, "instructions_g": 0.609, "branch_miss_pct": 2.236, "adversarial_long_piece_ratio": 0.9419, "ascii_prose_ratio": 0.9148, "ascii_prose_count_ratio": 0.9145, "cjk_ratio": 0.904, "code_ratio": 0.8888, "code_count_ratio": 0.8894, "mixed_unicode_ratio": 0.9252, "numeric_ratio": 0.9322, "short_strings_ratio": 0.9509, "whitespace_heavy_ratio": 0.9523}, "status": "keep", "description": "[C] H16 inline(always) rank_of + inline encode_piece: 10.53->9.67 (0.921 [0.920,0.923]); every arm 0.89-0.95", "timestamp": 1788491913597, "segment": 0, "confidence": null, "asi": {"hypothesis": "H16 inline(always) rank_of + inline encode_piece", "verdict": "KEEP", "learned": "span-length match constant-folds at each call site once inlined; ~8% instructions saved", "next": "C: AVX2 scan; D: LTO report; then re-attribute"}}
{"run": 22, "commit": "(none)", "metric": 0, "metrics": {}, "status": "discard", "description": "[D] H10 fat LTO + codegen-units=1 (bench-only profile override): mixed +-3%; no case for asking to change the workspace release profile; recorded as a recommendation only", "timestamp": 1788491948042, "segment": 0, "confidence": null, "asi": {"hypothesis": "H10 fat LTO + codegen-units=1 (bench-only profile override)", "verdict": "report (no change)", "evidence": "cycles: ascii_prose 1.03; code 1.02; cjk 0.97; short 0.99; numeric 1.03; whitespace 0.99 (perf stat, 40 iters)"}}
{"run": 23, "commit": "(none)", "metric": 0, "metrics": {}, "status": "discard", "description": "[C] H9b SSE2 16-byte class-run scan ahead of the 8-byte SWAR step: pieces average 2.5-7.5 bytes, so a 16-byte probe rarely completes and its setup (5 compares + movemask + an extra branch) costs more than the SWAR word it replaces; SIMD only pays on long single-class runs, which the heap arm already handles", "timestamp": 1788492008806, "segment": 0, "confidence": null, "asi": {"hypothesis": "H9b SSE2 16-byte class-run scan ahead of the 8-byte SWAR step", "verdict": "discard (prescreen)", "evidence": "cycles: ascii_prose 1.06; code 1.06; numeric 1.03; short 1.03; cjk 1.01; whitespace 1.01 (perf stat, 40 iters)", "next_action_hint": "scanner is no longer the bottleneck (rank_of 45-58%); the piece_end entry (contraction check + first-char class + space check) may be worth a table-driven fast path for 1-byte lead"}}
{"run": 24, "commit": "a1f46c4", "metric": 9.3153, "metrics": {"composite_ratio": 0.9631, "composite_ci_hi": 0.9644, "cold_start_us": 3221.9, "ipc": 2.082, "instructions_g": 0.422, "branch_miss_pct": 2.69, "adversarial_long_piece_ratio": 0.9945, "ascii_prose_ratio": 0.9295, "ascii_prose_count_ratio": 0.9299, "cjk_ratio": 0.98, "code_ratio": 0.9608, "code_count_ratio": 0.9618, "mixed_unicode_ratio": 0.982, "numeric_ratio": 0.9762, "short_strings_ratio": 0.9805, "whitespace_heavy_ratio": 0.9387}, "status": "keep", "description": "[A] H7e inline u128 keys for 8..=15-byte tokens: 9.67->9.32 (0.963 [0.962,0.964]); ascii_prose 0.930, whitespace 0.939; cold 2.75->3.22 ms (+16%, within 20% budget vs baseline 2.6 ms? no: guard compares to Phase-0 baseline 26 ms, fine)", "timestamp": 1788492270992, "segment": 0, "confidence": null, "asi": {"hypothesis": "H7e inline u128 keys for 8..=15-byte tokens", "verdict": "KEEP", "learned": "the byte-slice map now only serves tokens >= 16 bytes (~700 of 65k); ascii_prose also gained because the whole-piece miss path for 8+ byte pieces hits the inline table", "next": "re-attribute; iteration 25 A/A control due"}}
{"run": 25, "commit": "a1f46c4", "metric": 9.3167, "metrics": {"composite_ratio": 0.9988, "composite_ci_hi": 1.0002, "cold_start_us": 3243.8, "ipc": 2.09, "instructions_g": 0.422, "branch_miss_pct": 2.67, "adversarial_long_piece_ratio": 1.0003, "ascii_prose_ratio": 0.9979, "ascii_prose_count_ratio": 0.9984, "cjk_ratio": 0.9931, "code_ratio": 0.9989, "code_count_ratio": 0.9992, "mixed_unicode_ratio": 1.0008, "numeric_ratio": 0.9991, "short_strings_ratio": 0.999, "whitespace_heavy_ratio": 1.0014}, "status": "discard", "description": "[harness] A/A control (iteration 25 checkpoint): composite 0.9988 [0.9971,1.0002]; every arm within 0.7% of 1.0", "timestamp": 1788492306449, "segment": 0, "confidence": null, "asi": {"hypothesis": "A/A control (iteration 25 checkpoint)", "verdict": "AA_OK", "note": "harness still calibrated after 24 iterations; arm CIs now ~0.2-1% wide at the new 9.3 ns/B level"}}
{"run": 26, "commit": "(none)", "metric": 0, "metrics": {}, "status": "discard", "description": "[B] H14c two-pass min + position() in merge_scan rescan: the second pass costs more than the removed cmov on the piece lengths that dominate cjk/whitespace; the fused loop is already near 1 cycle/element", "timestamp": 1788492360775, "segment": 0, "confidence": null, "asi": {"hypothesis": "H14c two-pass min + position() in merge_scan rescan", "verdict": "discard (prescreen)", "evidence": "cycles: ascii 0.98 code 0.96 numeric 0.96 but short 1.07 cjk 1.09 whitespace 1.09 (perf stat)", "next_action_hint": "third merge_scan min-loop variant discarded; leave that loop. Lower ASCII heap threshold? crossover says 192 still right. Look at encode_bounded/piece_end entry cost (18-25% on ascii/code)"}}
{"run": 27, "commit": "1d11abc", "metric": 9.2111, "metrics": {"composite_ratio": 0.9889, "composite_ci_hi": 0.9896, "cold_start_us": 3199.8, "ipc": 2.209, "instructions_g": 0.473, "branch_miss_pct": 2.628, "adversarial_long_piece_ratio": 0.9996, "ascii_prose_ratio": 0.9857, "ascii_prose_count_ratio": 0.9867, "cjk_ratio": 1.0029, "code_ratio": 0.9676, "code_count_ratio": 0.9666, "mixed_unicode_ratio": 0.9944, "numeric_ratio": 0.9989, "short_strings_ratio": 0.9975, "whitespace_heavy_ratio": 0.9898}, "status": "keep", "description": "[C] H17 ASCII-lead fast path in piece_end: 9.32->9.21 (0.989 [0.988,0.990]); code 0.968, ascii 0.986; cjk 1.003 within CI", "timestamp": 1788492463143, "segment": 0, "confidence": null, "asi": {"hypothesis": "H17 ASCII-lead fast path in piece_end", "verdict": "KEEP", "learned": "small but clean; entry cost of piece_end now ~2 table loads for ASCII", "next": "REPORT refresh; then B: parts Vec capacity / scratch reuse across calls (short_strings malloc 7%)"}}
{"run": 28, "commit": "025f383", "metric": 9.3057, "metrics": {"composite_ratio": 1.0076, "composite_ci_hi": 1.0115, "cold_start_us": 3207.6, "ipc": 2.074, "instructions_g": 0.422, "branch_miss_pct": 2.676, "adversarial_long_piece_ratio": 1.0296, "ascii_prose_ratio": 1.0048, "ascii_prose_count_ratio": 1.0052, "cjk_ratio": 1.0188, "code_ratio": 1.0022, "code_count_ratio": 1.0019, "mixed_unicode_ratio": 1.0024, "numeric_ratio": 1.0196, "short_strings_ratio": 0.9374, "whitespace_heavy_ratio": 1.0583}, "status": "discard", "description": "[B] H18 thread-local Scratch reused across calls: composite 1.008 [1.003,1.012]; short_strings 0.937 but whitespace_heavy 1.058, cjk 1.019, adversarial 1.030", "timestamp": 1788492612040, "segment": 0, "confidence": null, "asi": {"hypothesis": "H18 thread-local Scratch reused across calls", "verdict": "DISCARD", "learned": "the RefCell borrow + TLS access is once per call (cheap) but passing &mut through the closure changed codegen of the merge loop (parts Vec now behind two indirections); long-piece arms lost more than short_strings gained. A per-call Scratch is fine for texts of any length; only tiny texts pay", "rollback_reason": "composite regression", "next_action_hint": "if short strings matter: size parts with_capacity from the piece length inside encode_piece to avoid growth; or pass scratch by value"}}
{"run": 29, "commit": "(none)", "metric": 0, "metrics": {}, "status": "discard", "description": "[B] H18b Cell::take/set thread-local Scratch (plain local in the loop): same shape as it. 28 with no indirection in the loop, so the loss is not the RefCell; instructions are flat while cycles rise on long-piece arms, which points at code layout/alignment of merge_scan shifting. Not pursued further", "timestamp": 1788492719673, "segment": 0, "confidence": null, "asi": {"hypothesis": "H18b Cell::take/set thread-local Scratch (plain local in the loop)", "verdict": "discard (prescreen)", "evidence": "cycles: short 0.95 but whitespace 1.10, cjk 1.04, numeric 1.04 (perf stat)"}}
{"run": 30, "commit": "(none)", "metric": 0, "metrics": {}, "status": "discard", "description": "[A] H8 direct-mapped piece->ids cache (4096 x 32 B, per call Scratch): runbook rule: discard unless short_strings and code both benefit; a cross-call cache needs the thread-local scratch that iterations 28-29 showed costs 4-10% on long-piece arms, and the win on this corpus is inflated by its ~600-word vocabulary (overfit risk)", "timestamp": 1788492781590, "segment": 0, "confidence": null, "asi": {"hypothesis": "H8 direct-mapped piece->ids cache (4096 x 32 B, per call Scratch)", "verdict": "discard (prescreen)", "evidence": "cycles: ascii 0.97, code 0.97, mixed 0.82, whitespace 0.97, but numeric 1.09, cjk 1.03, short_strings 5.6x (128 KiB zeroed per call)"}}
{"run": 31, "commit": "(none)", "metric": 0, "metrics": {}, "status": "discard", "description": "[C] H19 split class_at astral path (skip the BMP branch for 2-3 byte leads): no signal; branch was already well predicted", "timestamp": 1788492850397, "segment": 0, "confidence": null, "asi": {"hypothesis": "H19 split class_at astral path (skip the BMP branch for 2-3 byte leads)", "verdict": "discard (prescreen)", "evidence": "cycles within +-2% on every arm across two runs"}}
{"run": 32, "commit": "f54d2b9", "metric": 8.7312, "metrics": {"composite_ratio": 0.9492, "composite_ci_hi": 0.9507, "cold_start_us": 3221.0, "ipc": 2.675, "instructions_g": 0.547, "branch_miss_pct": 2.162, "adversarial_long_piece_ratio": 0.6286, "ascii_prose_ratio": 0.9999, "ascii_prose_count_ratio": 1.0, "cjk_ratio": 0.9238, "code_ratio": 0.9994, "code_count_ratio": 1.0018, "mixed_unicode_ratio": 1.001, "numeric_ratio": 1.0088, "short_strings_ratio": 0.997, "whitespace_heavy_ratio": 1.0143}, "status": "keep", "description": "[B] H20 packed u64 heap key: 9.21->8.73 (0.949 [0.948,0.951]); adversarial 0.629, cjk 0.924; whitespace 1.014 within rule", "timestamp": 1788492986129, "segment": 0, "confidence": null, "asi": {"hypothesis": "H20 packed u64 heap key", "verdict": "KEEP", "learned": "tuple compare in BinaryHeap sift is a real cost; single-register key halves heap time", "next": "bucket queue keyed by rank (ideas.md) could remove the heap entirely for cjk"}}
{"run": 33, "commit": "556cae4", "metric": 8.7718, "metrics": {"composite_ratio": 1.0041, "composite_ci_hi": 1.0055, "cold_start_us": 3228.5, "ipc": 2.136, "instructions_g": 0.4, "branch_miss_pct": 2.626, "adversarial_long_piece_ratio": 1.0, "ascii_prose_ratio": 0.9989, "ascii_prose_count_ratio": 0.9997, "cjk_ratio": 0.983, "code_ratio": 1.0, "code_count_ratio": 1.0007, "mixed_unicode_ratio": 0.9985, "numeric_ratio": 1.0016, "short_strings_ratio": 1.0609, "whitespace_heavy_ratio": 0.9994}, "status": "discard", "description": "[A] H3d heap thresholds 128/24 B: composite 1.004 [1.003,1.006]; cjk 0.983 but short_strings 1.061 (short-string pieces of 24-40 B non-ASCII now take the heap, whose fixed setup cost dominates there)", "timestamp": 1788493069266, "segment": 0, "confidence": null, "asi": {"hypothesis": "H3d heap thresholds 128/24 B", "verdict": "DISCARD", "learned": "crossover probe runs on homogeneous repeated-char pieces; real short strings with mixed content have fewer merges per byte, so the probe overstates the heap advantage at small n. Keep 192/40.", "next": "bucket queue idea would change this trade again; otherwise the loop is near its floor at this altitude"}}
{"run": 34, "commit": "(none)", "metric": 0, "metrics": {}, "status": "discard", "description": "[B] H21 bucket queue by rank (2-level bitmap) replacing BinaryHeap in merge_heap: a bucket queue needs per-bucket position order to keep leftmost-tie semantics, which degenerates on uniform runs; the binary heap already handles that in O(log n)", "timestamp": 1788493151569, "segment": 0, "confidence": null, "asi": {"hypothesis": "H21 bucket queue by rank (2-level bitmap) replacing BinaryHeap in merge_heap", "verdict": "discard (prescreen)", "evidence": "cycles: cjk 1.07, whitespace 0.99, short_strings 3.9x (65536 Vecs built per Scratch), adversarial 29x (all 64k initial pairs share one rank -> O(n) min scan per pop)"}}
{"run": 35, "commit": "(none)", "metric": 0, "metrics": {}, "status": "discard", "description": "[A] H4b count-only path as a second non-generic loop (ids cleared per piece): a second call site of the #[inline] encode_piece changes inlining for both sites and both paths lose; the count arms track encode within 0.5% anyway (the Vec is not the cost)", "timestamp": 1788493242534, "segment": 0, "confidence": null, "asi": {"hypothesis": "H4b count-only path as a second non-generic loop (ids cleared per piece)", "verdict": "discard (prescreen)", "evidence": "cycles: ascii 1.09, ascii_count 1.12, code 1.10, code_count 1.12, short 1.01; instructions +14%", "next_action_hint": "count-only path is closed: three shapes tried (Sink trait, const generic, duplicate loop); estimate_tokens == encode_ordinary.len() at no measurable cost"}}
